{
  "$schema": "https://json-schema.org/draft/2020-12/schema",
  "$id": "https://github.com/MoltyCel/aae-conformance-vectors/schema/enforce-vector-schema.json",
  "title": "AAE Enforce Conformance Vector",
  "description": "Schema for a single vector against the enforce kernel (draft-kroehl-agentic-trust-aae-02: grants with type_fields, the closed constraint language, the verdict vocabulary, ratification, and grant attenuation across delegation hops). This schema EXTENDS the vector set; it does not replace schema/vector-schema.json, which continues to govern the 15 AAE-native vectors in vectors/ unchanged, nor schema/interop-composition-vector-schema.json. The three families cannot share one schema: a native vector is a JWS evaluated by the Section 5 nine-step algorithm and answers ACCEPT/REJECT at a numbered step, while an enforce vector is a mandate plus a transaction, carries no JWS and no step number, and answers PERMIT/DENY/PENDING with a recomputable core digest. Merging them would mean dropping 'secured_aae' from required and widening the result enum, which would let a native vector claim PERMIT and validate.",
  "type": "object",
  "required": ["id", "name", "description", "section_ref", "kernel", "kernel_version", "input", "expected", "rationale"],
  "additionalProperties": false,
  "properties": {
    "id": {
      "type": "string",
      "pattern": "^aae-enforce-vector-[0-9]{2}$"
    },
    "name": { "type": "string", "minLength": 1 },
    "description": { "type": "string", "minLength": 1 },
    "section_ref": {
      "type": "string",
      "pattern": "draft-kroehl-agentic-trust-aae-[0-9]{2}"
    },
    "kernel": {
      "type": "string",
      "enum": ["enforce_check", "ratify"],
      "description": "Which kernel the vector exercises. 'enforce_check' takes a mandate and a transaction; 'ratify' takes a prior verdict record, a decision and an authority proof. They are separate machines with separate domain tags and separate version constants."
    },
    "kernel_version": {
      "type": "string",
      "pattern": "^[0-9]+\\.[0-9]+$",
      "description": "The value the kernel writes into the core as enforce_version or ratify_version. Pinned in the vector because the domain tags are part of the digest: a kernel on a different version computes different digests over the same input, and a vector that did not say which version it was built against would be unfalsifiable."
    },
    "domain_tags": {
      "type": "object",
      "description": "The domain tags the expected digests were computed under, as ASCII without the trailing NUL separator. Present so a verifier can tell a tag mismatch from a logic mismatch when a digest fails to reproduce.",
      "additionalProperties": { "type": "string", "pattern": "^aae:[a-z-]+:v[0-9]+$" }
    },
    "input": {
      "type": "object",
      "additionalProperties": false,
      "properties": {
        "mandate": {
          "description": "enforce_check: the mandate under evaluation. Deliberately untyped beyond 'any JSON value' — a vector that supplies a non-object mandate is a legitimate fail-closed case."
        },
        "transaction": {
          "description": "enforce_check: the transaction under evaluation, likewise untyped."
        },
        "prior_record": {
          "description": "ratify: the verdict record being ratified, as {core, core_digest}."
        },
        "decision": {
          "description": "ratify: the decision the authority asserts."
        },
        "authority_proof": {
          "description": "ratify: {mandate, authority, signature}. The public key is read from the mandate, never from the proof."
        },
        "prev_core_digest": {
          "description": "The chain link. Null or absent starts a chain. For a ratification it must equal the core digest of the record being ratified.",
          "type": ["string", "null"]
        },
        "ancestors": {
          "description": "enforce_check, optional: the parent mandates of a delegated mandate, root first, ending with its direct parent. Each hop is checked for grant attenuation (Section 5 step 9) and recorded as a grant_attenuation predicate whose value and bound are the child and parent mandate digests. Absent or empty adds nothing to the trace, so the core of an undelegated mandate is unchanged. Untyped beyond 'any JSON value' for the same reason as mandate: a malformed value is a fail-closed case."
        }
      }
    },
    "expected": {
      "type": "object",
      "additionalProperties": false,
      "properties": {
        "verdict": {
          "type": "string",
          "enum": ["PERMIT", "DENY", "PENDING"],
          "description": "enforce_check outcome. PERMIT only on a bound grant whose constraints all hold with disposition allow; PENDING only on an explicit hold; everything else DENY."
        },
        "status": {
          "type": "string",
          "enum": ["RATIFIED", "REJECTED"],
          "description": "ratify outcome. REJECTED leaves the prior record's verdict standing."
        },
        "decision": { "type": "string", "enum": ["APPROVED", "DISAPPROVED"] },
        "ratifies": { "type": "string", "pattern": "^sha256:[a-f0-9]{64}$" },
        "authority": { "type": ["string", "null"] },
        "grant_index": { "type": ["integer", "null"], "minimum": 0 },
        "core_digest": {
          "type": "string",
          "pattern": "^sha256:[a-f0-9]{64}$",
          "description": "The digest a conforming implementation must reproduce byte for byte from the input alone. This is the conformance target, not the verdict on its own."
        },
        "reason_contains": {
          "type": "string",
          "minLength": 1,
          "description": "A substring the reason must contain. A substring rather than the full string on purpose: draft -02 leaves the granularity of the reason text to the implementation (SHOULD, not MUST), so pinning it whole would test wording rather than behaviour."
        },
        "error": {
          "type": "string",
          "enum": ["RatifyError"],
          "description": "ratify only: the caller error raised instead of producing a record. Guard 2 (a PERMIT is not ratifiable) and Guard 3 (the chain link points elsewhere) take this path — there is nothing to record when the question itself does not line up."
        },
        "trace": {
          "type": "array",
          "minItems": 1,
          "description": "The predicate trace. A vector may state a subset: every entry listed must appear in the produced trace with the same result, in the order given. It need not enumerate the whole trace.",
          "items": {
            "type": "object",
            "required": ["predicate", "result"],
            "additionalProperties": false,
            "properties": {
              "predicate": { "type": "string", "minLength": 1 },
              "field": { "type": ["string", "null"] },
              "value": {},
              "bound": {},
              "result": { "type": "string", "enum": ["PASS", "FAIL"] },
              "reason_contains": { "type": "string", "minLength": 1 }
            }
          }
        }
      }
    },
    "rationale": { "type": "string", "minLength": 1 }
  },
  "allOf": [
    {
      "if": { "properties": { "kernel": { "const": "enforce_check" } }, "required": ["kernel"] },
      "then": {
        "properties": {
          "input": {
            "required": ["mandate", "transaction"],
            "not": { "anyOf": [
              { "required": ["prior_record"] },
              { "required": ["decision"] },
              { "required": ["authority_proof"] }
            ] }
          },
          "expected": {
            "required": ["verdict", "core_digest"],
            "not": { "anyOf": [
              { "required": ["status"] },
              { "required": ["error"] },
              { "required": ["ratifies"] },
              { "required": ["authority"] }
            ] }
          }
        }
      }
    },
    {
      "if": { "properties": { "kernel": { "const": "ratify" } }, "required": ["kernel"] },
      "then": {
        "properties": {
          "input": {
            "required": ["prior_record", "decision", "authority_proof"],
            "not": { "anyOf": [
              { "required": ["mandate"] },
              { "required": ["transaction"] },
              { "required": ["ancestors"] }
            ] }
          },
          "expected": {
            "not": { "anyOf": [
              { "required": ["verdict"] },
              { "required": ["grant_index"] }
            ] },
            "oneOf": [
              { "required": ["status", "core_digest", "ratifies"] },
              { "required": ["error"] }
            ]
          }
        }
      }
    }
  ]
}
