{
  "id": "aae-enforce-vector-27",
  "name": "Grant widened at hop — deny",
  "description": "The delegated mandate raises the parent's amount bound from 1000 to 5000. The transaction moves 500, inside both bounds.",
  "section_ref": "draft-kroehl-agentic-trust-aae-02",
  "kernel": "enforce_check",
  "kernel_version": "3.0",
  "domain_tags": {
    "action": "aae:enforce-action:v1",
    "mandate": "aae:enforce-mandate:v1",
    "transaction": "aae:enforce-transaction:v1",
    "core": "aae:enforce-core:v1"
  },
  "input": {
    "mandate": {
      "mandate_version": "1.0",
      "grants": [
        {
          "action_binding": "sha256:8c2938c57c38e44ed13ce9aef8a741bfc6e636fc60857c05c483078aa26cfb76",
          "type_fields": [
            "verb",
            "asset",
            "chain"
          ],
          "disposition": "allow",
          "constraints": [
            {
              "type": "exact",
              "field": "to",
              "value": "0xABCDEF0123456789ABCDEF0123456789ABCDEF01"
            },
            {
              "type": "range",
              "field": "amount",
              "lo": 0,
              "hi": 5000
            }
          ]
        }
      ]
    },
    "transaction": {
      "action": {
        "verb": "transfer",
        "asset": "USDC",
        "chain": "base"
      },
      "to": "0xABCDEF0123456789ABCDEF0123456789ABCDEF01",
      "amount": 500,
      "region": "CH"
    },
    "ancestors": [
      {
        "mandate_version": "1.0",
        "grants": [
          {
            "action_binding": "sha256:8c2938c57c38e44ed13ce9aef8a741bfc6e636fc60857c05c483078aa26cfb76",
            "type_fields": [
              "verb",
              "asset",
              "chain"
            ],
            "disposition": "allow",
            "constraints": [
              {
                "type": "exact",
                "field": "to",
                "value": "0xABCDEF0123456789ABCDEF0123456789ABCDEF01"
              },
              {
                "type": "range",
                "field": "amount",
                "lo": 0,
                "hi": 1000
              }
            ]
          }
        ]
      }
    ]
  },
  "expected": {
    "verdict": "DENY",
    "core_digest": "sha256:30aa3943ab39ac967523db491eb450b85a90ac29774cd1173e2485fdb80f041e",
    "grant_index": null,
    "reason_contains": "hop 0",
    "trace": [
      {
        "predicate": "mandate_present",
        "result": "PASS"
      },
      {
        "predicate": "grant_attenuation",
        "field": "ancestors[0]",
        "result": "FAIL"
      }
    ]
  },
  "rationale": "Section 5 step 9: every child grant has to be covered by a parent grant whose constraints it implies. A range that reaches past the parent's is not, and the hop is denied before any grant of the presented mandate is evaluated. That the transaction itself would pass the parent shows the verdict turns on the hop, not on the transaction."
}
