{
  "id": "aae-enforce-vector-21",
  "name": "forbid outranks an allowing grant — deny",
  "description": "Two grants bind the same action: the first allows, the second forbids.",
  "section_ref": "draft-kroehl-agentic-trust-aae-02",
  "kernel": "enforce_check",
  "kernel_version": "2.0",
  "domain_tags": {
    "action": "aae:enforce-action:v1",
    "mandate": "aae:enforce-mandate:v1",
    "transaction": "aae:enforce-transaction:v1",
    "core": "aae:enforce-core:v1"
  },
  "input": {
    "mandate": {
      "mandate_version": "1.0",
      "grants": [
        {
          "action_binding": "sha256:8c2938c57c38e44ed13ce9aef8a741bfc6e636fc60857c05c483078aa26cfb76",
          "type_fields": [
            "verb",
            "asset",
            "chain"
          ],
          "disposition": "allow",
          "constraints": [
            {
              "type": "exact",
              "field": "to",
              "value": "0xABCDEF0123456789ABCDEF0123456789ABCDEF01"
            },
            {
              "type": "range",
              "field": "amount",
              "lo": 0,
              "hi": 1000
            }
          ]
        },
        {
          "action_binding": "sha256:8c2938c57c38e44ed13ce9aef8a741bfc6e636fc60857c05c483078aa26cfb76",
          "type_fields": [
            "verb",
            "asset",
            "chain"
          ],
          "disposition": "forbid",
          "constraints": []
        }
      ]
    },
    "transaction": {
      "action": {
        "verb": "transfer",
        "asset": "USDC",
        "chain": "base"
      },
      "to": "0xABCDEF0123456789ABCDEF0123456789ABCDEF01",
      "amount": 500,
      "region": "CH"
    }
  },
  "expected": {
    "verdict": "DENY",
    "core_digest": "sha256:5a7cd00231edf83758ef4e682dcd969db0f24ca42951eb881b65e2f774fef540",
    "grant_index": 1,
    "reason_contains": "disposition=forbid",
    "trace": [
      {
        "predicate": "disposition",
        "result": "FAIL"
      }
    ]
  },
  "rationale": "A prohibition takes precedence over a permission for the same action, and the forbidding grant's own constraints are not evaluated — there is no condition under which a forbid becomes an allow."
}
