{
  "id": "aae-enforce-vector-29",
  "name": "Purpose enum grant widened — deny",
  "description": "The parent limits purpose_code to travel.booking; the delegated mandate adds finance.payment. The transaction declares travel.booking.",
  "section_ref": "draft-kroehl-agentic-trust-aae-02",
  "kernel": "enforce_check",
  "kernel_version": "3.0",
  "domain_tags": {
    "action": "aae:enforce-action:v1",
    "mandate": "aae:enforce-mandate:v1",
    "transaction": "aae:enforce-transaction:v1",
    "core": "aae:enforce-core:v1"
  },
  "input": {
    "mandate": {
      "mandate_version": "1.0",
      "grants": [
        {
          "action_binding": "sha256:8c2938c57c38e44ed13ce9aef8a741bfc6e636fc60857c05c483078aa26cfb76",
          "type_fields": [
            "verb",
            "asset",
            "chain"
          ],
          "disposition": "allow",
          "constraints": [
            {
              "type": "enum",
              "field": "purpose_code",
              "values": [
                "travel.booking",
                "finance.payment"
              ]
            },
            {
              "type": "range",
              "field": "amount",
              "lo": 0,
              "hi": 1000
            }
          ]
        }
      ]
    },
    "transaction": {
      "action": {
        "verb": "transfer",
        "asset": "USDC",
        "chain": "base"
      },
      "to": "0xABCDEF0123456789ABCDEF0123456789ABCDEF01",
      "amount": 500,
      "purpose_code": "travel.booking"
    },
    "ancestors": [
      {
        "mandate_version": "1.0",
        "grants": [
          {
            "action_binding": "sha256:8c2938c57c38e44ed13ce9aef8a741bfc6e636fc60857c05c483078aa26cfb76",
            "type_fields": [
              "verb",
              "asset",
              "chain"
            ],
            "disposition": "allow",
            "constraints": [
              {
                "type": "enum",
                "field": "purpose_code",
                "values": [
                  "travel.booking"
                ]
              },
              {
                "type": "range",
                "field": "amount",
                "lo": 0,
                "hi": 1000
              }
            ]
          }
        ]
      }
    ]
  },
  "expected": {
    "verdict": "DENY",
    "core_digest": "sha256:612e4fed5ffac6d0e35cfd95416107d560a7bdcfa4009a333f5e87c80ba36f89",
    "grant_index": null,
    "reason_contains": "purpose_code",
    "trace": [
      {
        "predicate": "grant_attenuation",
        "field": "ancestors[0]",
        "result": "FAIL"
      }
    ]
  },
  "rationale": "A purpose is narrowed with the means draft -02 already has: an enum constraint on a transaction field, attenuated like any other. mandate.purpose stays a free-text audit field and is not evaluated. A child enum that is a superset of the parent's widens the purpose and is denied, even for a transaction whose own purpose the parent allows."
}
