{
  "id": "aae-enforce-vector-01",
  "name": "Type form matches — permit",
  "description": "The action carries exactly the grant's type_fields and every constraint holds.",
  "section_ref": "draft-kroehl-agentic-trust-aae-02",
  "kernel": "enforce_check",
  "kernel_version": "2.0",
  "domain_tags": {
    "action": "aae:enforce-action:v1",
    "mandate": "aae:enforce-mandate:v1",
    "transaction": "aae:enforce-transaction:v1",
    "core": "aae:enforce-core:v1"
  },
  "input": {
    "mandate": {
      "mandate_version": "1.0",
      "grants": [
        {
          "action_binding": "sha256:8c2938c57c38e44ed13ce9aef8a741bfc6e636fc60857c05c483078aa26cfb76",
          "type_fields": [
            "verb",
            "asset",
            "chain"
          ],
          "disposition": "allow",
          "constraints": [
            {
              "type": "exact",
              "field": "to",
              "value": "0xABCDEF0123456789ABCDEF0123456789ABCDEF01"
            },
            {
              "type": "range",
              "field": "amount",
              "lo": 0,
              "hi": 1000
            }
          ]
        }
      ]
    },
    "transaction": {
      "action": {
        "verb": "transfer",
        "asset": "USDC",
        "chain": "base"
      },
      "to": "0xABCDEF0123456789ABCDEF0123456789ABCDEF01",
      "amount": 500,
      "region": "CH"
    }
  },
  "expected": {
    "verdict": "PERMIT",
    "core_digest": "sha256:ebf9a8f970ecf38a7c7fc0b6613ad36bb87e6e9ba5ba06baa5a9e981ee2142f1",
    "grant_index": 0,
    "reason_contains": "all constraints hold",
    "trace": [
      {
        "predicate": "type_fields",
        "result": "PASS"
      },
      {
        "predicate": "action_binding",
        "result": "PASS"
      },
      {
        "predicate": "disposition",
        "result": "PASS"
      }
    ]
  },
  "rationale": "The positive case the rest are measured against. PERMIT requires a bound grant, all constraints holding, and disposition allow — nothing else reaches it."
}
