{
  "id": "aae-enforce-vector-17",
  "name": "Unknown constraint type — deny",
  "description": "The grant carries a constraint of type `regex`, which the closed set does not define.",
  "section_ref": "draft-kroehl-agentic-trust-aae-02",
  "kernel": "enforce_check",
  "kernel_version": "2.0",
  "domain_tags": {
    "action": "aae:enforce-action:v1",
    "mandate": "aae:enforce-mandate:v1",
    "transaction": "aae:enforce-transaction:v1",
    "core": "aae:enforce-core:v1"
  },
  "input": {
    "mandate": {
      "mandate_version": "1.0",
      "grants": [
        {
          "action_binding": "sha256:8c2938c57c38e44ed13ce9aef8a741bfc6e636fc60857c05c483078aa26cfb76",
          "type_fields": [
            "verb",
            "asset",
            "chain"
          ],
          "disposition": "allow",
          "constraints": [
            {
              "type": "regex",
              "field": "to",
              "value": "^0xABC"
            }
          ]
        }
      ]
    },
    "transaction": {
      "action": {
        "verb": "transfer",
        "asset": "USDC",
        "chain": "base"
      },
      "to": "0xABCDEF0123456789ABCDEF0123456789ABCDEF01",
      "amount": 500,
      "region": "CH"
    }
  },
  "expected": {
    "verdict": "DENY",
    "core_digest": "sha256:4a2586e4a1d2aeb3eb0f02cee5dd7ad6848f84ddf17aecba3a58650c944c789b",
    "reason_contains": "no matching grant satisfied its constraints",
    "trace": [
      {
        "predicate": "regex",
        "result": "FAIL"
      }
    ]
  },
  "rationale": "The set of three is closed. What a verifier cannot evaluate, it does not permit — an unrecognized type is a failed predicate, never an ignored one."
}
