{
  "id": "aae-enforce-vector-19",
  "name": "Explicit hold — pending",
  "description": "A bound grant whose constraints hold carries disposition hold.",
  "section_ref": "draft-kroehl-agentic-trust-aae-02",
  "kernel": "enforce_check",
  "kernel_version": "2.0",
  "domain_tags": {
    "action": "aae:enforce-action:v1",
    "mandate": "aae:enforce-mandate:v1",
    "transaction": "aae:enforce-transaction:v1",
    "core": "aae:enforce-core:v1"
  },
  "input": {
    "mandate": {
      "mandate_version": "1.0",
      "grants": [
        {
          "action_binding": "sha256:8c2938c57c38e44ed13ce9aef8a741bfc6e636fc60857c05c483078aa26cfb76",
          "type_fields": [
            "verb",
            "asset",
            "chain"
          ],
          "disposition": "hold",
          "constraints": [
            {
              "type": "exact",
              "field": "to",
              "value": "0xABCDEF0123456789ABCDEF0123456789ABCDEF01"
            }
          ]
        }
      ]
    },
    "transaction": {
      "action": {
        "verb": "transfer",
        "asset": "USDC",
        "chain": "base"
      },
      "to": "0xABCDEF0123456789ABCDEF0123456789ABCDEF01",
      "amount": 500,
      "region": "CH"
    }
  },
  "expected": {
    "verdict": "PENDING",
    "core_digest": "sha256:d4a4415976f8d2b961e9be0e3f6c6564d212238ca0f53e3f2a9e401ce45b2166",
    "reason_contains": "disposition=hold",
    "trace": [
      {
        "predicate": "disposition",
        "result": "PASS"
      }
    ]
  },
  "rationale": "PENDING is reachable only from an explicit hold. It says the mandate defers this action, not that the verifier was unsure."
}
