{
  "id": "aae-enforce-vector-03",
  "name": "Type field missing from the action — deny",
  "description": "The grant names verb, asset and chain; the action omits chain.",
  "section_ref": "draft-kroehl-agentic-trust-aae-02",
  "kernel": "enforce_check",
  "kernel_version": "2.0",
  "domain_tags": {
    "action": "aae:enforce-action:v1",
    "mandate": "aae:enforce-mandate:v1",
    "transaction": "aae:enforce-transaction:v1",
    "core": "aae:enforce-core:v1"
  },
  "input": {
    "mandate": {
      "mandate_version": "1.0",
      "grants": [
        {
          "action_binding": "sha256:8c2938c57c38e44ed13ce9aef8a741bfc6e636fc60857c05c483078aa26cfb76",
          "type_fields": [
            "verb",
            "asset",
            "chain"
          ],
          "disposition": "allow",
          "constraints": []
        }
      ]
    },
    "transaction": {
      "action": {
        "verb": "transfer",
        "asset": "USDC"
      },
      "to": "0xABCDEF0123456789ABCDEF0123456789ABCDEF01",
      "amount": 500,
      "region": "CH"
    }
  },
  "expected": {
    "verdict": "DENY",
    "core_digest": "sha256:3ce49eaaf20b9806ef9caec2246951dd0ca377f421c2a1b8d288e9d6e02638a1",
    "reason_contains": "missing type_fields ['chain']",
    "trace": [
      {
        "predicate": "type_fields",
        "result": "FAIL"
      }
    ]
  },
  "rationale": "A partial action is not the action the grant bound. Both directions of the set comparison have to fail closed, not just the extra-field one."
}
