{
  "id": "aae-enforce-vector-22",
  "name": "Ratified by the issuing principal",
  "description": "The principal named in the mandate approves a DENY.",
  "section_ref": "draft-kroehl-agentic-trust-aae-02",
  "kernel": "ratify",
  "kernel_version": "2.0",
  "domain_tags": {
    "statement": "aae:enforce-ratify-statement:v1",
    "core": "aae:enforce-ratify-core:v1"
  },
  "input": {
    "prior_record": {
      "core": {
        "enforce_version": "2.0",
        "mandate_digest": "sha256:0400163a4a2d5dccb1f94e2bb8acbe75d30658016fe95fd7bb1520faec3e98a7",
        "transaction_digest": "sha256:4c17d7e8de44bf84838df729d67dafa6fe8b35a493299743c4944baece6875fe",
        "action_digest": "sha256:8c2938c57c38e44ed13ce9aef8a741bfc6e636fc60857c05c483078aa26cfb76",
        "verdict": "DENY",
        "grant_index": null,
        "reason": "no matching grant satisfied its constraints",
        "trace": [
          {
            "predicate": "mandate_present",
            "field": null,
            "value": null,
            "bound": null,
            "result": "PASS",
            "reason": "mandate structurally valid"
          },
          {
            "predicate": "type_fields",
            "field": "action",
            "value": [
              "asset",
              "chain",
              "verb"
            ],
            "bound": [
              "verb",
              "asset",
              "chain"
            ],
            "result": "PASS",
            "reason": "action carries exactly the type_fields of grant(s) [0]"
          },
          {
            "predicate": "action_binding",
            "field": "action",
            "value": "sha256:8c2938c57c38e44ed13ce9aef8a741bfc6e636fc60857c05c483078aa26cfb76",
            "bound": "sha256:8c2938c57c38e44ed13ce9aef8a741bfc6e636fc60857c05c483078aa26cfb76",
            "result": "PASS",
            "reason": "bound by grant(s) [0]"
          },
          {
            "predicate": "range",
            "field": "amount",
            "value": 500,
            "bound": {
              "lo": 0,
              "hi": 100
            },
            "result": "FAIL",
            "reason": "outside range"
          }
        ],
        "prev_core_digest": null
      },
      "core_digest": "sha256:1f3baf9163290df6c65466eae7186005e8585e88555755842386b83786067b7b"
    },
    "decision": "APPROVED",
    "authority_proof": {
      "mandate": {
        "mandate_version": "1.0",
        "principal": {
          "did": "did:web:example.com:registry",
          "public_key": "9d53a7a4431e299b0ceb950ccbd5bd6f4845cdd9c7bd38e1c9e4e26490f8f90e"
        },
        "grants": [
          {
            "action_binding": "sha256:8c2938c57c38e44ed13ce9aef8a741bfc6e636fc60857c05c483078aa26cfb76",
            "type_fields": [
              "verb",
              "asset",
              "chain"
            ],
            "disposition": "allow",
            "constraints": [
              {
                "type": "range",
                "field": "amount",
                "lo": 0,
                "hi": 100
              }
            ]
          }
        ]
      },
      "authority": "did:web:example.com:registry",
      "signature": "063c0d48d216db558dabd389210e6f5a3a916fe56423092e6b33bc28a0c48aab491bc67ba747d232854f11ddd16b91997ae4add131f7348c78176c3f243c7705"
    }
  },
  "expected": {
    "status": "RATIFIED",
    "decision": "APPROVED",
    "ratifies": "sha256:1f3baf9163290df6c65466eae7186005e8585e88555755842386b83786067b7b",
    "authority": "did:web:example.com:registry",
    "core_digest": "sha256:ddd57a910fa323e2ab9ef8011380a2abbe042cea905a21851ebf0ba41166910f",
    "reason_contains": "ratified by principal",
    "trace": [
      {
        "predicate": "mandate_binding",
        "result": "PASS"
      },
      {
        "predicate": "authority_in_mandate",
        "result": "PASS"
      },
      {
        "predicate": "authority_signature",
        "result": "PASS"
      }
    ]
  },
  "rationale": "History is corrected by appending. The prior record keeps its verdict and its digest; the ratification is a second record that refers to it."
}
