{
  "id": "aae-enforce-vector-26",
  "name": "Chain link set explicitly to the ratified record",
  "description": "prev_core_digest is supplied and equals the prior record's core digest.",
  "section_ref": "draft-kroehl-agentic-trust-aae-02",
  "kernel": "ratify",
  "kernel_version": "2.0",
  "domain_tags": {
    "statement": "aae:enforce-ratify-statement:v1",
    "core": "aae:enforce-ratify-core:v1"
  },
  "input": {
    "prior_record": {
      "core": {
        "enforce_version": "2.0",
        "mandate_digest": "sha256:0400163a4a2d5dccb1f94e2bb8acbe75d30658016fe95fd7bb1520faec3e98a7",
        "transaction_digest": "sha256:4c17d7e8de44bf84838df729d67dafa6fe8b35a493299743c4944baece6875fe",
        "action_digest": "sha256:8c2938c57c38e44ed13ce9aef8a741bfc6e636fc60857c05c483078aa26cfb76",
        "verdict": "DENY",
        "grant_index": null,
        "reason": "no matching grant satisfied its constraints",
        "trace": [
          {
            "predicate": "mandate_present",
            "field": null,
            "value": null,
            "bound": null,
            "result": "PASS",
            "reason": "mandate structurally valid"
          },
          {
            "predicate": "type_fields",
            "field": "action",
            "value": [
              "asset",
              "chain",
              "verb"
            ],
            "bound": [
              "verb",
              "asset",
              "chain"
            ],
            "result": "PASS",
            "reason": "action carries exactly the type_fields of grant(s) [0]"
          },
          {
            "predicate": "action_binding",
            "field": "action",
            "value": "sha256:8c2938c57c38e44ed13ce9aef8a741bfc6e636fc60857c05c483078aa26cfb76",
            "bound": "sha256:8c2938c57c38e44ed13ce9aef8a741bfc6e636fc60857c05c483078aa26cfb76",
            "result": "PASS",
            "reason": "bound by grant(s) [0]"
          },
          {
            "predicate": "range",
            "field": "amount",
            "value": 500,
            "bound": {
              "lo": 0,
              "hi": 100
            },
            "result": "FAIL",
            "reason": "outside range"
          }
        ],
        "prev_core_digest": null
      },
      "core_digest": "sha256:1f3baf9163290df6c65466eae7186005e8585e88555755842386b83786067b7b"
    },
    "decision": "DISAPPROVED",
    "authority_proof": {
      "mandate": {
        "mandate_version": "1.0",
        "principal": {
          "did": "did:web:example.com:registry",
          "public_key": "9d53a7a4431e299b0ceb950ccbd5bd6f4845cdd9c7bd38e1c9e4e26490f8f90e"
        },
        "grants": [
          {
            "action_binding": "sha256:8c2938c57c38e44ed13ce9aef8a741bfc6e636fc60857c05c483078aa26cfb76",
            "type_fields": [
              "verb",
              "asset",
              "chain"
            ],
            "disposition": "allow",
            "constraints": [
              {
                "type": "range",
                "field": "amount",
                "lo": 0,
                "hi": 100
              }
            ]
          }
        ]
      },
      "authority": "did:web:example.com:registry",
      "signature": "e5789fdf181271766be888ada2651d03079e46ddcfaee0ff171cd79b83ced59f6ff8e8f4ac8a595324747085ec2968567291f41c418b942904e38b190c845d05"
    },
    "prev_core_digest": "sha256:1f3baf9163290df6c65466eae7186005e8585e88555755842386b83786067b7b"
  },
  "expected": {
    "status": "RATIFIED",
    "decision": "DISAPPROVED",
    "ratifies": "sha256:1f3baf9163290df6c65466eae7186005e8585e88555755842386b83786067b7b",
    "authority": "did:web:example.com:registry",
    "core_digest": "sha256:72f3249d1b2459344cd48ec1197797c627fcae1fc45c2d7439dfc57e8477a128",
    "reason_contains": "prior DENY -> DISAPPROVED"
  },
  "rationale": "The permitted half of Guard 3, and the DISAPPROVED half of the decision vocabulary. Supplying the link explicitly is allowed and yields the same record as leaving it out, because the fallback inserts the same value."
}
