{
  "id": "aae-enforce-vector-15",
  "name": "range holds at the upper bound — permit",
  "description": "The amount equals `hi`, which the closed interval includes.",
  "section_ref": "draft-kroehl-agentic-trust-aae-02",
  "kernel": "enforce_check",
  "kernel_version": "2.0",
  "domain_tags": {
    "action": "aae:enforce-action:v1",
    "mandate": "aae:enforce-mandate:v1",
    "transaction": "aae:enforce-transaction:v1",
    "core": "aae:enforce-core:v1"
  },
  "input": {
    "mandate": {
      "mandate_version": "1.0",
      "grants": [
        {
          "action_binding": "sha256:8c2938c57c38e44ed13ce9aef8a741bfc6e636fc60857c05c483078aa26cfb76",
          "type_fields": [
            "verb",
            "asset",
            "chain"
          ],
          "disposition": "allow",
          "constraints": [
            {
              "type": "range",
              "field": "amount",
              "lo": 0,
              "hi": 1000
            }
          ]
        }
      ]
    },
    "transaction": {
      "action": {
        "verb": "transfer",
        "asset": "USDC",
        "chain": "base"
      },
      "to": "0xABCDEF0123456789ABCDEF0123456789ABCDEF01",
      "amount": 1000,
      "region": "CH"
    }
  },
  "expected": {
    "verdict": "PERMIT",
    "core_digest": "sha256:12ffd8acb72332ef3c7e86885defc263d801bb360c079335e607d6db0e693aa7",
    "trace": [
      {
        "predicate": "range",
        "field": "amount",
        "result": "PASS"
      }
    ]
  },
  "rationale": "Both bounds are inclusive. The boundary is where an off-by-one would show, so the positive case sits on it rather than in the middle."
}
