{
  "id": "aae-enforce-vector-18",
  "name": "Field path with an empty segment — deny",
  "description": "The constraint names the path `action..verb`.",
  "section_ref": "draft-kroehl-agentic-trust-aae-02",
  "kernel": "enforce_check",
  "kernel_version": "2.0",
  "domain_tags": {
    "action": "aae:enforce-action:v1",
    "mandate": "aae:enforce-mandate:v1",
    "transaction": "aae:enforce-transaction:v1",
    "core": "aae:enforce-core:v1"
  },
  "input": {
    "mandate": {
      "mandate_version": "1.0",
      "grants": [
        {
          "action_binding": "sha256:8c2938c57c38e44ed13ce9aef8a741bfc6e636fc60857c05c483078aa26cfb76",
          "type_fields": [
            "verb",
            "asset",
            "chain"
          ],
          "disposition": "allow",
          "constraints": [
            {
              "type": "exact",
              "field": "action..verb",
              "value": "transfer"
            }
          ]
        }
      ]
    },
    "transaction": {
      "action": {
        "verb": "transfer",
        "asset": "USDC",
        "chain": "base"
      },
      "to": "0xABCDEF0123456789ABCDEF0123456789ABCDEF01",
      "amount": 500,
      "region": "CH"
    }
  },
  "expected": {
    "verdict": "DENY",
    "core_digest": "sha256:66a3a60bf7ce6d0361835be6ddb5a4f3e15d0a7781969a03ebb8e15d1a907c37",
    "trace": [
      {
        "predicate": "exact",
        "field": "action..verb",
        "result": "FAIL"
      }
    ]
  },
  "rationale": "An empty path segment is rejected outright rather than skipped. Skipping it would make `a..b` and `a.b` the same path, and two verifiers could then disagree about which field a constraint names."
}
