{
  "id": "aae-enforce-vector-28",
  "name": "Grant narrowed at hop — permit",
  "description": "The delegated mandate keeps the recipient and lowers the amount bound to 100. The transaction moves 50.",
  "section_ref": "draft-kroehl-agentic-trust-aae-02",
  "kernel": "enforce_check",
  "kernel_version": "3.0",
  "domain_tags": {
    "action": "aae:enforce-action:v1",
    "mandate": "aae:enforce-mandate:v1",
    "transaction": "aae:enforce-transaction:v1",
    "core": "aae:enforce-core:v1"
  },
  "input": {
    "mandate": {
      "mandate_version": "1.0",
      "grants": [
        {
          "action_binding": "sha256:8c2938c57c38e44ed13ce9aef8a741bfc6e636fc60857c05c483078aa26cfb76",
          "type_fields": [
            "verb",
            "asset",
            "chain"
          ],
          "disposition": "allow",
          "constraints": [
            {
              "type": "exact",
              "field": "to",
              "value": "0xABCDEF0123456789ABCDEF0123456789ABCDEF01"
            },
            {
              "type": "range",
              "field": "amount",
              "lo": 0,
              "hi": 100
            }
          ]
        }
      ]
    },
    "transaction": {
      "action": {
        "verb": "transfer",
        "asset": "USDC",
        "chain": "base"
      },
      "to": "0xABCDEF0123456789ABCDEF0123456789ABCDEF01",
      "amount": 50,
      "region": "CH"
    },
    "ancestors": [
      {
        "mandate_version": "1.0",
        "grants": [
          {
            "action_binding": "sha256:8c2938c57c38e44ed13ce9aef8a741bfc6e636fc60857c05c483078aa26cfb76",
            "type_fields": [
              "verb",
              "asset",
              "chain"
            ],
            "disposition": "allow",
            "constraints": [
              {
                "type": "exact",
                "field": "to",
                "value": "0xABCDEF0123456789ABCDEF0123456789ABCDEF01"
              },
              {
                "type": "range",
                "field": "amount",
                "lo": 0,
                "hi": 1000
              }
            ]
          }
        ]
      }
    ]
  },
  "expected": {
    "verdict": "PERMIT",
    "core_digest": "sha256:6fbcdb405c7b01f27afa64fefae57f7f7ec258556568c633b0ee4aae5fd7adf4",
    "grant_index": 0,
    "reason_contains": "all constraints hold",
    "trace": [
      {
        "predicate": "grant_attenuation",
        "field": "ancestors[0]",
        "result": "PASS"
      },
      {
        "predicate": "type_fields",
        "result": "PASS"
      },
      {
        "predicate": "action_binding",
        "result": "PASS"
      },
      {
        "predicate": "disposition",
        "result": "PASS"
      }
    ]
  },
  "rationale": "The positive half of 27. The hop passes, is recorded with the child and parent mandate digests as value and bound, and grant evaluation runs as for an undelegated mandate."
}
